col0,col1,col2,col3
Skegness Gramma School,2012/09/01,William Waynflete,Skegness
Sir Joseph Willamson's Mathematical School,1701/01/01,Joseph Williamson,Medway
The King'sSchool,2013/04/01,Edward VI of England,Wakefield
Tottenham Gammar School,1631/01/01,"John Seymour, 4th Duke of Somerset",Tottenham
The Harvey Grammar Schol,1674/01/01,Eliab Harvey,Folkestone
Sir Walter St John's Grammar Sdhool For Boys,1700/01/01,"Sir Walter St John, 3rd Baronet",London Borough of Wandsworth
The Laymer School,1624/01/01,Edward Latymer,London Borough of Enfield
Royal Latn School,2011/09/01,Edward VI of England,Buckingham
