col0,col1,col2,col3,col4
Diputación Provincial de Toledo,Spain,1835-01-01,Edificio de la Diputación de Toledo,provincial deputation
Diputación Provincial de Teruel,Spain,1900-01-01,Teruel,provincial deputation
Diputación Provincial de Segovia,Spain,1821-01-01,Segovia,provincial deputation
Diputación de Salamanca,Spain,1813-01-01,Palacio de La Salina (Salamanca),provincial deputation
Diputación Provincial de Palencia,Spain,1813-09-04,Palacio de la Diputación de Palencia,provincial deputation
