col0,col1,col2,col3
Pasco–Hernando Community College,1967-01-01,public educational institution of the United States,baccalaureate/associate's colleges: associate's dominant four year colleges
Pasadena City College,1924-01-01,public educational institution of the United States,associate's colleges: high transfer-high traditional
Pima Community College,1969-01-01,community college,associate's colleges: high transfer-mixed traditional/nontraditional
Pikes Peak Community College,1968-01-01,community college,associate's colleges: mixed transfer/career & technical-mixed traditional/nontraditional
Piedmont Virginia Community College,1972-01-01,community college,associate's colleges: high transfer-high nontraditional
Piedmont Community College,1970-01-01,community college,associate's colleges: mixed transfer/career & technical-mixed traditional/nontraditional
