col0,col1,col2,col3
University of North Carolina at Chapel Hill,University of North Carolina,"103 South Bldg Cb 9100, Chapel Hill, NC, 27599",ibiblio
University of Virginia,Monticello and the University of Virginia in Charlottesville,"1827 University Avenue, Charlottesville, VA, 22903-2628",John Paul Jones Arena
University of North Carolina at Chapel Hill,University of North Carolina,"103 South Bldg Cb 9100, Chapel Hill, NC, 27599",Kenan Memorial Stadium
University of Virginia,Monticello and the University of Virginia in Charlottesville,"1827 University Avenue, Charlottesville, VA, 22903-2628",Scott Stadium
"University of California, Berkeley",University of California,"200 California Hall, Berkeley, CA, 94720",California Memorial Stadium
University of Oregon,Oregon University System,"110 Johnson Hall, Eugene, OR, 97403",KWVA
University at Buffalo,State University of New York,"12 Capen Hall, Buffalo, NY, 14260-1660",Barbara and Jack Davis Hall
University of Oregon,Oregon University System,"110 Johnson Hall, Eugene, OR, 97403",John E. Jaqua Center for Student Athletes
