col0,col1,col2,col3,col4
Federal Financial Supervisory Authority,Bonn,Germany,2002-05-01,Network of Central Banks and Supervisors for Greening the Financial System
Federal Commissioner for Data Protection and Freedom of Information,Bonn,federal agency of Germany,1978-01-01,IT-Planungsrat
Federal Office for Food and Agriculture,Bonn,Germany,1995-01-01,Informationsdienst Wissenschaft e.V.
Federal Agency for Civic Education,Bonn,Germany,1952-11-25,Bundesnetzwerk Bürgerschaftliches Engagement
Federal Office for Building and Regional Planning,Schloss Deichmannsaue,Germany,1998-01-01,Working Group of the German Federal Departmental Research  Establishments
