col0,col1,col2,col3,col4
St. Catherine University,North Central Association of Colleges and Schools,master's colleges and universities: larger programs,Saint Paul,Associated Colleges of the Twin Cities
Willamette University,Annapolis Group,baccalaureate colleges: arts and sciences focus,Salem,Scholarly Publishing and Academic Resources Coalition
Rice University,Association of American Universities,doctoral university: highest research activity,Houston,Scholarly Publishing and Academic Resources Coalition
Bowdoin College,Annapolis Group,baccalaureate colleges: arts and sciences focus,Maine,Scholarly Publishing and Academic Resources Coalition
Marquette University,Association of Jesuit Colleges and Universities,doctoral university: higher research activity,Milwaukee,Association of Jesuit Colleges and Universities
Rose-Hulman Institute of Technology,Association of Independent Technological Universities,special focus four-year: engineering schools,Terre Haute,Association of Independent Technological Universities
Andrews University,Council of Independent Colleges,doctoral university: moderate research activity,Michigan,LIGO Scientific Collaboration
Smith College,National Association of Independent Colleges and Universities,research doctoral: single program - other,Massachusetts,Center for Research Libraries
Sacred Heart University,Association of Catholic Colleges and Universities,master's colleges and universities: larger programs,Connecticut,Scholarly Publishing and Academic Resources Coalition
