col0,col1,col2,col3
Sacred Heart School of Theology,Hales Corners,special focus four-year: faith-related institutions,"7335 S Hwy 100, Franklin, WI, 53132"
University of Saint Mary of the Lake,Mundelein,special focus four-year: faith-related institutions,"1000 E Maple Ave, Mundelein, IL, 60060-1174"
St. Vincent de Paul Regional Seminary,Boynton Beach,special focus four-year: faith-related institutions,"10701 South Military Trail, Boynton Beach, FL, 33436-4899"
Sacred Heart Major Seminary,Detroit,special focus four-year: faith-related institutions,"2701 Chicago Blvd, Detroit, MI, 48206-1799"
Saint Joseph Seminary College,Louisiana,special focus four-year: faith-related institutions,"75376 River Road, St. Benedict, LA, 70457"
St. Charles Borromeo Seminary,Pennsylvania,special focus four-year: faith-related institutions,"100 East Wynnewood Road, Wynnewood, PA, 19096"
Saint Vincent Seminary,Pennsylvania,special focus four-year: faith-related institutions,"300 Fraser Purchase Rd, Latrobe, PA, 15650-2690"
St. Bernard's School of Theology and Ministry,New York,special focus four-year: faith-related institutions,"120 French Road, Rochester, NY, 14618"
