col0,col1,col2,col3
"Palucca School of Dance, Dresden",drama school,German Rectors' Conference,1925-01-01
Hochschule f端r Musik Saar,drama school,German Rectors' Conference,1947-01-01
Ernst Busch Academy of Dramatic Arts,drama school,German Rectors' Conference,1951-01-01
Rostock University of Music and Theatre,drama school,German Rectors' Conference,1994-01-01
Hochschule f端r Musik und Theater Hamburg,drama school,German Rectors' Conference,1950-01-01
Aleksander Zelwerowicz State Theatre Academy,drama school,Collegium Nobilium,1932-01-01
Hochschule f端r Musik und Theater M端nchen,drama school,German Rectors' Conference,1846-01-01
