col0,col1,col2,col3,col4
The Trinity Church of England Primary Academy,academy school,Diocese of Salisbury,Church of England,Diocese of Salisbury
Staverton Church of England Voluntary Primary School,academy school,Diocese of Peterborough,Church of England,Diocese of Peterborough
St Andrew's Church of England Primary School,academy school,Diocese of Salisbury,Church of England,Diocese of Salisbury
Trinity Church of England Primary School,academy school,Diocese of Peterborough,Church of England,Diocese of Peterborough
St James' Church of England Primary School,academy school,Anglican Diocese of Liverpool,Church of England,Anglican Diocese of Liverpool
St Helen's Church of England Primary School,academy school,Anglican Diocese of Liverpool,Church of England,Anglican Diocese of Liverpool
St Paul's Church of England Primary School,academy school,Anglican Diocese of Liverpool,Church of England,Anglican Diocese of Liverpool
St Joseph's Catholic Primary School,academy school,Roman Catholic Diocese of Brentwood,Roman Catholic,Roman Catholic Diocese of Brentwood
