col0,col1,col2,col3
Apostolic Nunciature to Liberia,Liberia,1929-01-01,"Mamba Point, Gordan Street, Monrovia"
Apostolic Nunciature to Pakistan,Pakistan,1950-01-01,"Diplomatic Enclave N. 1, 5th Street, G.P.O. Box 1106, Islamabad 44000"
Apostolic Nunciature to Australia,Australia,1914-01-01,"2 Vancouver Stret, Red Hill, Canberra, ACT 2603; PO Box 3633, Manuka, ACT 2603"
Apostolic Nunciature to South Africa,South Africa,1922-12-07,"4 Argo Street, 0181 Waterkloof Ridge (Pretoria)"
Apostolic Nunciature to Malta,Malta,1965-01-01,"20/22, Pietru Caxaru Street, Tal-Virtù, Rabat RBT 2604"
Apostolic Nunciature to Ukraine,Ukraine,1992-02-08,Turhenivska Street 40
Apostolic Nunciature to Ethiopia,Ethiopia,1937-01-01,"Makanissa Road, P.O. Box 588, Addis Ababa"
Apostolic Nunciature to Sudan,Sudan,1972-04-29,"Kafouri Belgravia, P.O. Box 623, Khartoum"
Apostolic Nunciature to Jordan,Jordan,1994-04-06,"14 Anton El-Naber Street, Amman"
