col0,col1,col2
Thf Fratellis,2005/01/01,Brit Award for British Breakthrough Act
Elattic,1992/01/01,Brit Award for British Breakthrough Act
ABC,1980/01/01,Brit Award for British Breakthrough Act
One Ok Rocl,2005/01/01,MTV Europe Music Award for Best Japanese Act
Shadowy Me on a Shadowy Plaet,1984/01/01,Juno Award for Instrumental Album of the Year
Bel Orchestre,2002/01/01,Juno Award for Instrumental Album of the Year
riumph,1975/01/01,Juno Award for Group of the Year
Thuderheist,2010/01/01,Juno Award for Dance Recording of the Year
