col0,col1,col2,col3
Study of INTERCEPT Blood System for Red Blood Cells in Regions at Potential Risk for Zika Virus Transfusion-Transmitted Infections,phase III clinical trial,600,2018-11-30
"Fludarabine Phosphate, Low-Dose Total-Body Irradiation, and Peripheral Blood Stem Cell Transplant Followed by Donor Lymphocyte Infusion in Treating Older Patients With Chronic Myeloid Leukemia",phase II clinical trial,18,2005-03-31
A Study of Multiple Immunotherapy-Based Treatment Combinations in Participants With Metastatic Pancreatic Ductal Adenocarcinoma,phase II clinical trial,205,2019-11-16
A Study Evaluating the Efficacy and Safety of Multiple Immunotherapy-Based Treatment Combinations in Patients With Metastatic Colorectal Cancer,phase II clinical trial,160,2021-05-23
VRC 705: A Zika Virus DNA Vaccine in Healthy Adults and Adolescents,phase II clinical trial,2338,2020-01-31
