col0,col1,col2,col3
"Ministry of Agriculture, Fisheries and Food",agriculture ministry,Quebec City,Minister of Agriculture
Ministry of Agriculture and Rural Development of Israel,agriculture ministry,Beit Dagan,Minister of Agriculture and Rural Development
"Ministry of Agriculture, Nature and Food Quality",agriculture ministry,The Hague,Minister of Agriculture
Ministry of Agriculture and Natural Resources,ministry of Cyprus Republic,Nicosia Municipality,Cyprus Minister of Agriculture and Natural Resources
"Ministry of Agriculture, Natural Resources and Environment",ministry of Cyprus Republic,Nicosia Municipality,"Cyprus Minister of Agriculture, Natural Resources and Environment"
"Ministry of Agriculture, Forestry and Water Economy of the Republic of Serbia",ministry of fisheries,Belgrade,Minister of Agriculture
Ministry of Agriculture and Natural Resources,natural resources ministry,Nicosia Municipality,Cyprus Minister of Agriculture and Natural Resources
"Ministry of Agriculture, Natural Resources and Environment",natural resources ministry,Nicosia Municipality,"Cyprus Minister of Agriculture, Natural Resources and Environment"
