col0,col1,col2,col3
Princess of Wales Hospital Library,43.0,Abertawe Bro Morgannwg University Health Board,Bridgend
"Miners' Library, Ysbyty Ystrad Fawr",97.1,Aneurin Bevan University Health Board,Hengoed
Royal Glamorgan Hospital Library,62.2,Cwm Taf University Health Board,Llantrisant
Glan Clwyd Hospital Library,14.2,Betsi Cadwaladr University Health Board,Rhyl
Public Health Wales Library Mold,122.0,Public Health Wales NHS Trust,Mold
Neath Port Talbot Hospital Library,8.3,Abertawe Bro Morgannwg University Health Board,Port Talbot
Prince Philip Hospital Library,26.0,Hywel Dda University Health Board,Llanelli
Withybush General Hospital Library,32.4,Hywel Dda University Health Board,Haverfordwest
Bronllys Hospital Library,162.4,Powys Teaching Health Board,Brecon
