col0,col1,col2,col3
Effectiveness of Multiple Micro-nutrient Fortified Fudge on Nutritional Status of 3-5 Years of Age Children,3,5,480
RGX-121 Gene Therapy in Patients With MPS II (Hunter Syndrome),4,5,6
Study of the Hummingbird TTS™ Tympanostomy Tube System,6,5,167
Colchicine in Postoperative Fontan Patients,24,5,25
Fit 5 Kids Screen Time Reduction Curriculum for Latino Preschoolers,3,5,280
"Prevention of Atelectasis, Via High Flow Nasal Cannula to Obtain a PEP, During General Anesthesia in Children",6,5,40
Lung Ultrasound for Acute Respiratory Infections by Community Health Workers,2,5,122
Comparison Between Melatonin and Diazepam for Prevention of Recurrent Simple Febrile Seizures,6,5,60
