col0,col1,col2,col3,col4
National Chengchi University,Taipei,open-access publisher,Chiang Kai-shek Library,"ORCID, Inc."
National Chiao Tung University,Hsinchu,open-access publisher,National Chiao Tung University Library,"ORCID, Inc."
National Taiwan University,Taipei,research university,National Taiwan University Hospital,"ORCID, Inc."
University of Tokyo,Bunkyō-ku,research university,University of Tokyo Library,International Alliance of Research Universities
National Taiwan University,Taipei,comprehensive university,National Taiwan University Hospital,"ORCID, Inc."
National Chengchi University,Taipei,national university,Chiang Kai-shek Library,"ORCID, Inc."
