col0,col1,col2,col3
Watshishou Migratory Bird Sanctuary,1925-03-09,Aguanish,Canadian Wildlife Service
Couvée Islands Migratory Bird Sanctuary,1986-01-01,Urban agglomeration of Longueuil,Canadian Wildlife Service
Senneville Migratory Bird Sanctuary,1936-06-22,Urban agglomeration of Montreal,Canadian Wildlife Service
Big Glace Bay Lake Migratory Bird Sanctuary,1939-01-01,Cape Breton County,Canadian Wildlife Service
Amherst Point Migratory Bird Sanctuary,1947-01-01,Cumberland County,Canadian Wildlife Service
Saint-Augustin Migratory Bird Sanctuary,1925-01-01,Saint-Augustin,Canadian Wildlife Service
