col0,col1,col2,col3,col4
Adelaide,Corporation of the City of Adelaide,22063,City of Adelaide,Lord Mayor of Adelaide
The Coorong,The Coorong District Council,5380,The Coorong,District Chairman of the Coorong
Berri and Barmera,Berri Barmera Council,10545,Berri and Barmera,Mayor of Berri and Barmera
Renmark Paringa,District Council of Renmark Paringa,9475,Renmark Paringa,Mayor of Renmark Paringa
Barossa,Barossa Council,23558,Barossa,Mayor of the Barossa
Grant,District Council of Grant,8203,Grant,District Chairman of Grant
Murray Bridge,Rural City of Murray Bridge,20858,Murray Bridge,Mayor of Murray Bridge
Loxton Waikerie,District Council of Loxton Waikerie,11487,Loxton Waikerie,Mayor of Loxton Waikerie
