col0,col1,col2,col3
Ministry of National Economy of the Kingdom of Italy,1923-08-01,Ministry of Corporations of the Kingdom of Italy,Kingdom of Italy
"Ministry of Agriculture, Industry and Trade of the Kingdom of Italy",1878-06-30,"Ministry of Industry, Trade and Labor of the Kingdom of Italy",Kingdom of Italy
Ministry of National Economy of the Kingdom of Italy,1923-08-01,Ministry of Agriculture and Forests of the Kingdom of Italy,Kingdom of Italy
"Ministry of Agriculture, Industry and Trade of the Kingdom of Sardinia",1860-07-05,"Ministry of Agriculture, Industry and Trade of the Kingdom of Italy",Kingdom of Sardinia
Ministry of Agriculture and Forestry,1998-01-01,Ministry for Primary Industries,New Zealand
