col0,col1,col2,col3,col4,col5
Mega Man Anniversary Collection,PlayStation 2,Capcom,Everyone,Atomic Planet Entertainment,single-player video game
Dead or Alive Ultimate,Xbox,Tecmo,Mature 17+,Team Ninja,single-player video game
Mortal Kombat Arcade Kollection,Microsoft Windows,Warner Bros. Interactive Entertainment,Mature 17+,NetherRealm Studios,single-player video game
Metal Gear Solid HD Collection,PlayStation 3,Konami,Teen,Kojima Productions,single-player video game
Serious Sam: The First Encounter,Microsoft Windows,Take-Two Interactive,Mature 17+,Croteam,single-player video game
Final Fantasy Chronicles,PlayStation,Square,Teen,Tose Co.,single-player video game
F.E.A.R. Files,Xbox 360,Sierra Entertainment,Mature 17+,Wargaming West Corporation,single-player video game
Ratchet & Clank Collection,PlayStation 3,Sony Interactive Entertainment,Teen,Insomniac Games,single-player video game
