col0,col1,col2
Omni San Francisco Hotel,United States of America,Historic Hotels of America
Omni Royal Cresent Hotel,United States of America,Historic Hotels of America
Omni La Mansión del Rio,United States of America,Historic Hotels of America
Las Casas Filipinas de Açúzar,Philippines,Historic Hotels Worldwide
Grand Hotel Kempinski High Tatras,Slovakia,Historic Hotels Worldwide
"Gran Hotel Montesol Ibiza, Curio Collection by Hilton",Spain,Historic Hotels Worldwide
Fru Haugans Hotel,Norway,Historic Hotels Worldwide
Hotel New Grand,Japan,Historic Hotels Worldwide
Mark Hopkins Hotel,United States of America,Historic Hotels of America
