col0,col1,col2,col3
Ukraine at the Deaflympics 2017,Ukraine at the Deaflympics,Ukraine,2017 Summer Deaflympics
Tanzania at the 2018 Commonwealth Games,Tanzania at the Commonwealth Games,Tanzania,2018 Commonwealth Games
Nicaragua at the 1987 Pan American Games,Nicaragua at the Pan American Games,Nicaragua,1987 Pan American Games
Iceland at the UEFA Euro 2016,Iceland at the UEFA European Football Championship,Iceland,UEFA Euro 2016
Nicaragua at the 2015 Pan American Games,Nicaragua at the Pan American Games,Nicaragua,2015 Pan American Games
Honduras at the 2015 Pan American Games,Honduras at the Pan American Games,Honduras,2015 Pan American Games
Argentina at the 2015 Pan American Games,Argentina at the Pan American Games,Argentina,2015 Pan American Games
Chile at the 2015 Pan American Games,Chile at the Pan American Games,Chile,2015 Pan American Games
Anguilla at the 2014 Commonwealth Games,Anguilla at the Commonwealth Games,Anguilla,2014 Commonwealth Games
Tanzania at the 2014 Commonwealth Games,Tanzania at the Commonwealth Games,Tanzania,2014 Commonwealth Games
Nicaragua at the 1991 Pan American Games,Nicaragua at the Pan American Games,Nicaragua,1991 Pan American Games
Spain at the 1954 European Athletics Championships,Spain at the European Athletics Championships,Spain,1954 European Athletics Championships
