col0,col1,col2,col3,col4,col5
The effects of scaling height and scaling bar design on applied forces and bilateral muscle activity of the back and shoulders,Sean Gallagher,National Institute for Occupational Safety and Health,A proposed standard procedure for static muscle strength testing.,2006-10-01,Proceedings of the Human Factors and Ergonomics Society Annual Meeting
Bone mineral content and fatigue failure of lumbar motion segments in simulated flexed lifting: does specimen age influence the relationship?,Sean Gallagher,National Institute for Occupational Safety and Health,Mechanical behavior of the human lumbar spine. II. Fatigue strength during dynamic compressive loading.,2005-09-01,Proceedings of the Human Factors and Ergonomics Society Annual Meeting
Impact of loading and rest intervals on muscle inflammation,Sean Gallagher,National Institute for Occupational Safety and Health,Eccentric contraction induces inflammatory responses in rat skeletal muscle: role of tumor necrosis factor-alpha,2014-09-01,Proceedings of the Human Factors and Ergonomics Society Annual Meeting
Facial shape variation of U.S. respirator users,Ziqing Zhuang,National Institute for Occupational Safety and Health,Head-and-face anthropometric survey of U.S. respirator users,2009-07-19,Lecture Notes in Computer Science
Effects of load and posture on the recruitment of trunk muscles,Sean Gallagher,National Institute for Occupational Safety and Health,Prospective validation of a low-back disorder risk model and assessment of ergonomic interventions associated with manual materials handling tasks,2002-09-01,Proceedings of the Human Factors and Ergonomics Society Annual Meeting
Biomechanical modeling of asymmetric lifting tasks in constrained lifting postures,Sean Gallagher,National Institute for Occupational Safety and Health,"Lifting in stooped and kneeling postures: effects on lifting capacity, metabolic costs, and electromyography of eight trunk muscles",1990-10-01,Proceedings of the Human Factors and Ergonomics Society Annual Meeting
Do inflammatory responses to eccentric exercise suggest a fatigue failure process?,Sean Gallagher,National Institute for Occupational Safety and Health,The interaction of force and repetition on musculoskeletal and neural tissue responses and sensorimotor behavior in a rat model of work-related musculoskeletal disorders,2014-09-01,Proceedings of the Human Factors and Ergonomics Society Annual Meeting
