col0,col1,col2
Chamber of Commerce Industry and Agriculture Timisoara,Timișoara,Romania
Federation of Hong Kong Industries,Kowloon,People's Republic of China
The Australian Chamber of Commerce (AustCham) Hong Kong and Macau,Hong Kong,People's Republic of China
Suffolk Chamber of Commerce,Ipswich,United Kingdom
Greater Birmingham Chambers of Commerce,Birmingham,United Kingdom
Russo-British Chamber of Commerce,London,United Kingdom
Chamber of commerce Grand Lille,Lille metropolis,France
Regional Chamber of Commerce and Industry Midi-Pyrénées,Blagnac,France
Chambre de commerce et d'industrie de Bayonne Pays basque,Bayonne,France
Chambre de Commerce de La Rochelle,La Rochelle,France
Chambre de commerce et d'industrie du Morbihan,Lorient,France
Chambre de commerce et d'industrie de Saint-Malo,Ille-et-Vilaine,France
Regional Chamber of Commerce and Industry of the Pays de la Loire,Nantes,France
Burgundy Regional Chamber of Commerce and Industry,Dijon,France
Rhône-Alpes Regional Chamber of Commerce and Industry,Lyon,France
chamber of commerce of Lyon,Lyon,France
Ankara Chamber of Industry,Çankaya,Turkey
İzmir Chamber of Commerce,İzmir,Turkey
Camera di commercio di Milano,Milan,Italy
Green Bay Chamber of Commerce,Green Bay,United States of America
