col0,col1,col2,col3
Cosmic Background Explorer,Vandenberg AFB Space Launch Complex 2,Goddard Space Flight Center,cosmic microwave background experiment
Reuven Ramaty High Energy Solar Spectroscopic Imager,Stargazer,National Aeronautics and Space Administration,solar observatory
Wide-field Infrared Survey Explorer,Vandenberg AFB Space Launch Complex 2,Jet Propulsion Laboratory,infrared telescope
Microvariability and Oscillations of Stars,Plesetsk Cosmodrome Site 133,Canadian Space Agency,Maksutov telescope
Microvariability and Oscillations of Stars,Plesetsk Cosmodrome Site 133,Canadian Space Agency,catadioptric system
TUGSAT-1,Satish Dhawan Space Centre First Launch Pad,Graz University of Technology,space observatory
Hisaki,Uchinoura Space Center,Japan Aerospace Exploration Agency,space observatory
HALCA,Uchinoura Space Center,Institute of Space and Astronautical Science,space observatory
