col0,col1,col2,col3,col4
Roman Catholic Diocese of Segorbe-Castellón,Bishop of Segorbe-Castellón,Roman Rite,Castelló de la Plana,Casimiro López Llorente
Roman Catholic Diocese of San Cristóbal de La Laguna,bishop of San Cristóbal de La Laguna,Roman Rite,San Cristóbal de La Laguna,Bernardo Álvarez Afonso
Roman Catholic Diocese of San Sebastián,Bishop of San Sebastián,Roman Rite,Donostia-San Sebastian,José Ignacio Munilla Aguirre
Roman Catholic Diocese of Segovia,Bishop of Segovia,Roman Rite,Segovia,César Augusto Franco Martínez
Roman Catholic Diocese of Sant Feliu de Llobregat,bishop of San Feliu de Llobregat,Roman Rite,Sant Feliu de Llobregat,Agustín Cortés Soriano
Roman Catholic Diocese of Cremona,Bishop of Cremona,Roman Rite,Cremona,Antonio Napolioni
"Roman Catholic Diocese of León, Spain",Bishop of León,Roman Rite,León,Julián López Martín
Roman Catholic Diocese of Albacete,Bishop of Albacete,Roman Rite,Albacete,Ángel Fernández Collado
Roman Catholic Diocese of Alcalá de Henares,Bishop of Alcalá de Henares,Roman Rite,Alcalá de Henares,Juan Antonio Reig Plà
