col0,col1,col2,col3,col4
Edo State House of Assembly,24,24,Edo State,member of the Edo State House of Assembly
Ebonyi State House of Assembly,24,24,Ebonyi State,member of the Ebonyi State House of Assembly
Delta State House of Assembly,29,29,Delta State,member of the Delta State House of Assembly
Cross River State House of Assembly,25,25,Cross River State,member of the Cross River State House of Assembly
Borno State House of Assembly,28,28,Borno State,member of the Borno State House of Assembly
Benue State House of Assembly,29,29,Benue State,member of the Benue State House of Assembly
Bayelsa State House of Assembly,24,24,Bayelsa State,member of the Bayelsa State House of Assembly
Anambra State House Of Assembly,30,30,Anambra State,member of the Anambra State House of Assembly
Akwa Ibom State House of Assembly,26,26,Akwa Ibom State,member of the Akwa Ibom State House of Assembly
