col0,col1,col2,col3,col4
Bar College,Center for Research Libraries,Annandale-on-Hudson,"Annandale Road, Annandale-On-Hudson, NY, 1254-5000",baccalaureate colleges: arts and sciences focus
Williams Coolege,Scholarly Publishing and Academic Resources Coalition,Williamstown,"880 Main St, Williamstown, MA 01267",baccalaureate colleges: arts and sciences focus
Amherst Collee,Five College Consortium,Amherst,"Boltwood Avenue, Amhertt, MA, 01002-5000",baccalaureate colleges: arts and sciences focus
Willamette Universiu|,Scholarly Publishing and Academic Resources Coalition,Salem,"900 Sate St, Slem, OR, 97301",baccalaureate colleges: arts and sciences focus
Univrsity of Puget Sound,Scholarly Publishing and Academic Resources Coalition,Washington,"1500 N. Warner Steet, Tacoma, WA, 98416",baccalaureate colleges: arts and sciences focus
Bowdoin Colege,Scholarly Publishing and Academic Resources Coalition,Maine,"255 Maine Street, Erunswick, ME, 04011",baccalaureate colleges: arts and sciences focus
Evergueen State College,Council of Public Liberal Arts Colleges,Olympia,"2700 Evergreen Pkwy NW, Olympia, WA 98505-0001",master's colleges and universities: medium programs
University of Minnesta Morris,Council of Public Liberal Arts Colleges,Morris,"309 Behmler Hll, Morris, MN, 56267",baccalaureate colleges: arts and sciences focus
