col0,col1,col2
Badminton Association of Ghana,1974-01-01,Ghana national badminton team
Fédération Camerounaise de Badminton,1994-01-01,Cameroon national badminton team
Surinaamse Badminton Bond,1958-11-16,Suriname national badminton team
Federación Mexicana de Bádminton,1961-01-01,Mexico national badminton team
Jamaica Badminton Association,1937-01-01,Jamaica national badminton team
Bermuda Badminton Association,1920-01-01,Bermuda national badminton team
Sri Lanka Badminton Association,1950-01-01,Sri Lanka national badminton team
Pakistan Badminton Federation,1953-01-01,Pakistan national badminton team
