col0,col1,col2,col3,col4,col5
Ma'ale Tzviya,Misgav Regional Council,1979-01-01,257,intentional community,Israel
Hoshaya,Jezreel Valley Regional Council,1980-01-01,235,Nahal settlement,Israel
"Neta, Israel",Lakhish Regional Council,2012-01-01,425,community settlement,Israel
Nitzan,Hof Ashkelon Regional Council,1949-01-01,43,community settlement,Israel
Tzukei Yam,Hefer Valley Regional Council,1956-01-01,28,community settlement,Israel
Shoshanat HaAmakim,Hefer Valley Regional Council,1951-01-01,17,community settlement,Israel
Mishmar David,Gezer Regional Council,1948-01-01,156,community settlement,Israel
Srigim,Mateh Yehuda Regional Council,1960-01-01,320,community settlement,Israel
