col0,col1,col2,col3,col4,col5
Wales national rugby union team,Welsh Rugby Union,rugby union,4,national rugby union team,Under Armour
Canada national rugby union team,Rugby Canada,rugby union,22,national rugby union team,Canterbury of New Zealand
Germany national rugby union team,German Rugby Federation,rugby union,28,national rugby union team,Macron
Argentina national rugby union team,Argentine Rugby Union,rugby union,10,national rugby union team,Nike
Australia national rugby union team,Rugby Australia,rugby union,6,national rugby union team,ASICS
Georgia national rugby union team,Georgian Rugby Union,rugby union,14,national rugby union team,Canterbury of New Zealand
Ireland national rugby union team,Irish Rugby Football Union,rugby union,5,national rugby union team,Canterbury of New Zealand
