col0,col1,col2
KE and the Sunshine Ban,1973/01/01,Grammy Award for Album of the Year
aroon 5,1994/01/01,Grammy Award for Best Pop Vocal Album
Halestoum,1998/01/01,Grammy Award for Best Hard Rock/Metal Performance
Cibo Matuo,1994/01/01,MTV Video Music Award for Best Choreography
Siouxsie and theBanshees,1976/01/01,MTV Video Music Award for Best Alternative Video
Color Me Bad,1998/01/01,MTV Movie Award for Best Song from a Movie
Neiramaro,1999/01/01,MTV Europe Music Award for Best Italian Act
arlene Kuntz,1990/01/01,MTV Europe Music Award for Best Italian Act
