col0,col1,col2,col3,col4
München Rosenheimer Platz station,DB Netz,1972-01-01,S1 (Munich),MVV fare zone 1
Berlin Hackescher Markt station,DB Station&Service,1882-01-01,S5 (Berlin),Berlin A fare zone
Berlin Brandenburger Tor station,DB Station&Service,1936-07-27,S1 (Berlin),Berlin A fare zone
Rostock Thierfelder Straße railway station,DB Station&Service,2000-01-01,RB 11 (Mecklenburg-Vorpommern),VVW Rostock fare zone
Schwabhausen (bei Dachau) station,DB Netz,1912-07-08,S2,MVV fare zone 8
Ahrensfelde Nord station,DB Station&Service,1983-05-29,RB 25,Berlin C fare zone
Tessin station,DB Station&Service,1895-11-16,RB 11 (Mecklenburg-Vorpommern),VVW fare zone 9
