col0,col1,col2
"Technological Center, Federal University of Espírito Santo",Federal University of Espírito Santo,Espírito Santo
The Metropolitan Andrey Sheptytsky Center,Ukrainian Catholic University,Lviv
Indiana University School of Informatics and Computing,Indiana University – Purdue University Indianapolis,Indianapolis
Indiana University School of Health and Human Sciences,Indiana University – Purdue University Indianapolis,Indiana
Faculty of Occupational Medicine,Royal College of Physicians of Ireland,Dublin
Colegio Primitivo y Nacional de San Nicolás de Hidalgo,Universidad Michoacana de San Nicolás de Hidalgo,Michoacán
SWPS University Faculty of Arts and Social Sciences,SWPS University of Social Sciences and Humanities,Warsaw
