col0,col1,col2,col3,col4
"Consulate General of Japan, Recife",Brazil,Japan,Recife,2018-01-01
Consulate General of Mongolia in Osaka,Japan,Mongolia,Ōsaka,2012-03-14
Consulate General of Hungary in Krakow,Poland,Hungary,Kraków,1921-09-09
"Consulate General of Northern Cyprus, Istanbul",Turkey,Turkish Republic of Northern Cyprus,Istanbul,1981-01-01
"Consulate General of the United States, Thessaloniki",Greece,United States of America,Municipality of Thessaloniki,1870-01-01
Consulate General of the Republic of Slovenia in Monoštor,Hungary,Slovenia,Szentgotthárd,1998-11-18
