col0,col1,col2,col3
National Library of Kazakhstan,Kazakhstan,1931-01-01,Almaty
National Library of Maldives,Maldives,1945-01-01,Malé
National Library of Korea,South Korea,1945-01-01,Seoul
Hong Kong Central Library,People's Republic of China,2001-01-01,Hong Kong
National Library of Namibia,Namibia,1926-01-01,Windhoek
National Library of Northern Cyprus,Turkish Republic of Northern Cyprus,1958-01-01,Nicosia
Sudan Library,Sudan,1966-01-01,Khartoum
National Central Library,Taiwan,1933-01-01,Taipei
National Library of Malaysia,Malaysia,1956-01-01,Kuala Lumpur
