col0,col1,col2,col3
Roman Catholic Diocese of Iași,Iași,Roman Catholic Diocese of Satu Mare,1884-06-27
Romanian Catholic Eparchy of Oradea Mare,Oradea,Hungarian Greek Catholic Archeparchy of Hajdúdorog,1777-01-01
Roman Catholic Diocese of Surabaya,Surabaya,Roman Catholic Diocese of Palangkaraya,1928-01-01
Roman Catholic Diocese of Szombathely,Szombathely,Roman Catholic Archdiocese of Maribor,1777-01-01
Roman Catholic Diocese of Szeged–Csanád,Szeged,Roman Catholic Diocese of Vác,1030-01-01
Roman Catholic Diocese of Pécs,Pécs,Roman Catholic Diocese of Székesfehérvár,1009-01-01
Roman Catholic Diocese of Vác,Vác,Roman Catholic Diocese of Banská Bystrica,1009-01-01
Roman Catholic Diocese of Mukacheve,Mukachevo,Roman Catholic Archdiocese of Košice,1993-01-01
Roman Catholic Diocese of Székesfehérvár,Székesfehérvár,Roman Catholic Diocese of Vác,1777-01-01
