col0,col1,col2
Georgia Institute of Technology,United States of America,Scholarly Publishing and Academic Resources Coalition
Massachusetts Institute of Technology,United States of America,Scholarly Publishing and Academic Resources Coalition
AGH University of Science and Technology,Poland,European Society for Engineering Education
TU Wien,Austria,eduroam
Florida Institute of Technology,United States of America,Oak Ridge Associated Universities
Mapúa University,Philippines,National Collegiate Athletic Association
Institut industriel du Nord,France,Société industrielle du Nord de la France
Grenoble Institute of Technology,France,Renater
