col0,col1,col2
Deutsche Gesellschaft f端r Ultraschall in der Medizin,Informationsdienst Wissenschaft e.V.,registered association
Deutsche Gesellschaft f端r Schlafforschung und Schlafmedizin,Informationsdienst Wissenschaft e.V.,registered association
Deutsche Gesellschaft f端r Rheumatologie,Informationsdienst Wissenschaft e.V.,registered association
DGPPN,Informationsdienst Wissenschaft e.V.,registered association
Gesellschaft f端r Biochemie und Molekularbiologie,Deutsches Nationalkomitee Biologie,registered association
Deutsche Multiple Sklerose Gesellschaft,German Parity Welfare Association,registered association
Deutscher Tierschutzbund,German alliance for nature conservation,registered association
Deutscher Braunkohlen-Industrie-Verein,Confederation of German Employers' Associations,registered association
Gesamtverband der Deutschen Versicherungswirtschaft,European Movement Germany,registered association
German tourism industry,European Movement Germany,registered association
