col0,col1,col2,col3,col4,col5
Sporozoite Challenge of Polyprotein Vaccinees,phase I clinical trial,26,50,United Kingdom,2006-09-01
Evaluation of Single and Repeat Doses of GSK729327 in Healthy Volunteers,phase I clinical trial,79,55,United Kingdom,2006-11-01
"Safety, Tolerability and Pharmacokinetic Study of Single and Multiple Intravenous Doses of RSV604 in Healthy Subjects.",phase I clinical trial,48,50,United Kingdom,2006-10-01
Safety and Tolerability of AQW051 in Elderly Healthy Volunteers.,phase I clinical trial,72,80,United Kingdom,2006-05-01
Safety Study of Tarceva in Children With Refractory and Relapsed Malignant Brain Tumors and Newly Diagnosed Brain Stem Glioma,phase I clinical trial,48,21,France,2005-06-01
Combined High Frequency Oscillation and Tracheal Gas Insufflation for Severe Acute Respiratory Distress Syndrome,phase I clinical trial,54,75,Greece,2006-07-01
