col0,col1,col2
Orange Park Elementary School,place listed on the National Register of Historic Places,Florida
Old Lutz Elementary School,place listed on the National Register of Historic Places,Florida
Old Hernando Elementary School,place listed on the National Register of Historic Places,Florida
Oakland Park Elementary School,place listed on the National Register of Historic Places,Florida
Osnovna šola Bojana Ilicha,registered immobile cultural heritage of Slovenia,Maribor
Kerttuli school,protected by the law on the protection of the architectural heritage in Finland,Turku
Lorne Street Primary School,category B listed building,Glasgow City
Ladypool Primary School,Grade II* listed building or structure,Birmingham
