col0,col1,col2,col3,col4
Fraunhofer Institute for Chemical Technology,Fraunhofer Society,1959-01-01,Germany,Pfinztal
Fraunhofer Institute for Applied Systems Engineering,Fraunhofer Society,1995-01-01,Germany,Ilmenau
Fraunhofer Institute for Open Communication Systems,Fraunhofer Society,2001-01-01,Germany,Tempelhof-Schöneberg
Fraunhofer MEVIS,Fraunhofer Society,1995-01-01,Germany,Bremen
Fraunhofer Institute for Intelligent Analysis and Information Systems,Fraunhofer Society,2006-01-01,Germany,Sankt Augustin
Fraunhofer Institute for Applied Information Technology,Fraunhofer Society,1968-01-01,Germany,Sankt Augustin
Fraunhofer Institute for Algorithms and Scientific Computing,Fraunhofer Society,1992-01-01,Germany,Sankt Augustin
Fraunhofer Institute for Industrial Mathematics,Fraunhofer Society,1991-01-01,Germany,Kaiserslautern
