col0,col1,col2,col3
University Hospitals of Leicester,United Kingdom,Glenfield Hospital,Leicester
NU Hospital Group,Sweden,Norra Älvsborgs Länssjukhus,Trollhättan
Derby Hospitals NHS Foundation Trust,United Kingdom,Derbyshire Children's Hospital,Derby
SSM Health Care,United States of America,Cardinal Glennon Children's Hospital,St. Louis
Royal Liverpool and Broadgreen University Hospitals NHS Trust,United Kingdom,Broadgreen Hospital,Liverpool
Assistance Publique-Hôpitaux de Marseille,France,Hôpital Nord Félix Houphouet Boigny,Marseille
