col0,col1,col2
Prieuré de l'Oiselière,Catholicism,registered historic monument
église Saint-Sauveur de Beaumont-en-Auge,Catholicism,registered historic monument
prieuré Saint-Sardos de Laurenque,Catholicism,registered historic monument
chapelle de l'ermitage de Franchard,Catholicism,registered historic monument
Prieuré de Prémontrés Saint-Jean d'Hannapes,Catholicism,bien recensé dans l'inventaire général du patrimoine culturel
Priory of Plessis-Grimoult,Catholicism,registered historic monument
