col0,col1,col2,col3
Bank of Uganda,Uganda,Kampala,National Statistical System
Bank of Thailand,Thailand,Bangkok,national statistical system of Thailand
Bank Negara Malaysia,Malaysia,Kuala Lumpur,national statistical system of Malaysia
National Bank of Cambodia,Cambodia,Phnom Penh,National Statistical System
Swiss National Bank,Switzerland,Scwiss national bank,The system of official statistics
Central Bank of Iceland,Iceland,Reykjavík,national statistical system of Iceland
Bank of Slovenia,Slovenia,Ljubljana,System of national statistics
Oesterreichische Nationalbank,Austria,Alsergrund,national statistical system of Austria
Bulgarian National Bank,Bulgaria,Sofia,National Statistical System
