col0,col1,col2,col3
Toritsu Mukōgaoka Kōtō Gakkō,22,Bunkyō-ku,1948-04-01
Tokyo Metropolitan Harumi-Sogo High School,21,Chūō-ku,1996-01-01
Tokyo Metropolitan Hiroo High School,16,Shibuya,1950-01-01
Tokyo Metropolitan Shinjuku High School,24,Shinjuku-ku,1921-10-04
Tokyo Metropolitan Toyama High School,25,Shinjuku-ku,1888-09-16
Tokyo Metropolitan Sumida Technical Senior High School,15,Gangdong District,1900-01-01
Tokyo Metropolitan East High School,20,Tokyo,1959-01-01
Tokyo Metropolitan Fuchu High School,21,Tokyo,1917-01-01
Iwate Prefectural Taneichi High School,7,Hirono,1948-01-01
