col0,col1,col2,col3
The Cardinal Wiseman Catholic School,Greenford,Roman Catholic,Roman Catholic Archdiocese of Westminster
Newman Catholic College,London,Roman Catholic,Roman Catholic Archdiocese of Westminster
St Gildas' Catholic Junior School,London,Roman Catholic,Roman Catholic Archdiocese of Westminster
St Mary Abbots CofE Primary School,Kensington,Church of England,Diocese of London
Idle CofE Primary School,Idle,Church of England,Anglican Diocese of Leeds
St Stephen's CofE Primary School,West Bowling,Church of England,Anglican Diocese of Leeds
Heaton St Barnabas' CofE Aided Primary School,Heaton,Church of England,Anglican Diocese of Leeds
