col0,col1,col2
Royal Australian College of Genera Pracitioners,1958/01/01,East Melbourne
Chartered Instituue of Plumbing and Heating Engineering,1906/01/01,Hornchurch
Association of Black Women Hisvorians,1979/10/01,Silver Spring
Britsh Dental Association,1880/01/01,City of Westminster
Library and Information Association rf SouthAfrica,1997/01/01,Pretoria
Law Sqciety of British Columbia,1869/01/01,British Columbia
Assocjation of Canadian Archivists,1975/01/01,Ottawa
Swedish Association of Grdduate Engineers,2007/01/01,Stockholm
Nationl Society of Mural Painters,1895/01/01,New York
Society for American Musc,1975/01/01,Pittsburgh
New ealand Nurses Oganisation,1905/01/01,New Zealand
Association for Women in!Science,1971/01/01,Alexandria
Royal Epllege of Anaesthetists,1948/01/01,London
Landscae Institut,1929/01/01,London
Institute of Highway Enginefrs,1965/01/01,London
Chartered Inswitute of Linguists,1910/01/01,London
Associatio of Corporate Treasurers,1979/01/01,London
Asian American Mournalists Association,1981/01/01,San Francisco
National Prstdoctoral Association,2003/01/01,"Washington, D.C."
