col0,col1,col2
Chiesa di Santa Maria Assunta,Italian national heritage,Monteriggioni
Pieve dei Santi Stefano e Degna,Italian national heritage,Castiglione d'Orcia
San Giovanni Battista (Pieve Asciata),Italian national heritage,Castelnuovo Berardenga
Sant'Agata,Italian national heritage,Asciano
San Giovanni in Sugana,Italian national heritage,San Casciano in Val di Pesa
Pieve di Santa Maria (Dicomano),Italian national heritage,Dicomano
San Giovanni (Arliano),Italian national heritage,Lucca
