col0,col1,col2,col3,col4
House of Assembly of Prince Edward Island,1893-01-01,1773-01-01,General Assembly of Prince Edward Island,Canadian legislative assembly
Legislative Assembly of Upper Canada,1841-01-01,1791-01-01,Parliament of Upper Canada,Canadian legislative assembly
Legislative Assembly of Quebec,1968-12-31,1867-07-01,Legislature of Quebec,Canadian legislative assembly
Chamber of Counties,2001-01-01,1993-01-01,Parliament of Croatia,lower house
Chamber of Deputies,1962-01-01,1948-01-01,Union Parliament,lower house
Chamber of Deputies of Venezuela,1999-01-01,1999-01-01,Congress,lower house
