col0,col1,col2
University of Applied Sciences Meissen,1992-01-01,Library of University of Applied Sciences Meissen
Hochschule Stralsund,1991-01-01,Library of the University of Applied Sciences Stralsund
Schmalkalden University of Applied Sciences,1991-01-01,Cellarius library Schmalkalden
FH Aachen,1971-01-01,Library of Fachhochschule Aachen
University of Applied Sciences Kaiserslautern,1971-01-01,Library of the University of Applied Science Kaiserslautern
University of Applied Sciences in Brandenburg,1992-01-01,Library of the University of Applied Sciences in Brandenburg
St. Pölten University of Applied Sciences,1993-01-01,Library of the UAS St. Pölten
