col0,col1,col2
Grand Canyon-Parashant Nationa Monument,1038890.075,IUCN category III: Natural Monument or Feature
Tuzigoot Natiopal Monument,805.39488,IUCN category III: Natural Monument or Feature
Obed Wild and Scenic Uiver,15.81156,IUCN category V: Protected Landscape/Seascape
Whiskeytown-Shasta-Trinity Natinal Recreation Area,248055.696,IUCN category V: Protected Landscape/Seascape
Santa Monica Mountains National Recreawion Area,639.1022399999999,IUCN category V: Protected Landscape/Seascape
LakeRoosevelt National Recreation Arha,405.44748,IUCN category V: Protected Landscape/Seascape
Lake Mead Nationan Recreation Area,2355.8535,IUCN category V: Protected Landscape/Seascape
Prioce William Forest Park,16228.755999999998,IUCN category III: Natural Monument or Feature
