col0,col1,col2,col3
Venetian Autonomy League,The Olive Tree,Mario Rigo,Liga Veneta
The Other Russia,opposition to Vladimir Putin in Russia,Eduard Limonov,National Bolshevik Party
Italian Radicals,Group of the Alliance of Liberals and Democrats for Europe,Marco Pannella,Bonino List
UDEUR Populars for the South,The Olive Tree,Clemente Mastella,Democratic Union for the Republic
National Front,Social Alternative,Adriano Tilgher,Tricolour Flame
Movement for Autonomies,New Pole for Italy,Raffaele Lombardo,Union of the Centre
Liberal Democrats,New Pole for Italy,Lamberto Dini,Democracy Is Freedom – The Daisy
Finns Party,European Conservatives and Reformists,Timo Soini,Finnish Rural Party
Gibraltar Socialist Labour Party,GSLP–Liberal Alliance,Joe Bossano,Democratic Party of British Gibraltar
