col0,col1,col2
Sony Music Entertainment Germany GmbH,Germany,Sony BMG Music Entertainment (Germany) GmbH
"Vogue France, S.A.",France,"Vogue Productions Internationales Phonographiques, S.A."
"Sony BMG Music Entertainment (UK), Ltd.",United Kingdom,Sony Music Entertainment (UK) Ltd.
Sony Music Entertainment UK Limited,United Kingdom,"Sony BMG Music Entertainment (UK), Ltd."
"Ariola-Sonopress, GmbH",Germany,"Ariola Schallplatten, GmbH"
Elektra Records Corp.,United States of America,Elektra-Stratford Record Corporation
Warner Bros. Records Limited,United Kingdom,Warner Bros. - Seven Arts Records Limited
"Warner Bros. Records Of Canada, Ltd.",Canada,"Warner Bros.-Seven Arts Records Of Canada, Ltd."
