col0,col1,col2,col3,col4
Liverpool Heart and Chest Hospital NHS Foundation Trust,United Kingdom,Liverpool,NHS foundation trust,Liverpool Heart and Chest Hospital
Heart of England NHS Foundation Trust,United Kingdom,Birmingham,NHS foundation trust,Good Hope Hospital
Guy's and St Thomas' NHS Foundation Trust,United Kingdom,London,NHS foundation trust,Guy's Hospital
Hampshire Hospitals NHS Foundation Trust,United Kingdom,Basingstoke,NHS foundation trust,North Hampshire Hospital
Bradford Teaching Hospitals NHS Foundation Trust,United Kingdom,Bradford,NHS foundation trust,Bradford Royal Infirmary
Chesterfield Royal Hospital NHS Foundation Trust,United Kingdom,Chesterfield,NHS foundation trust,Chesterfield Royal Hospital
Camden and Islington NHS Foundation Trust,United Kingdom,London,NHS foundation trust,St Pancras Hospital
