col0,col1,col2
LuEsther T. Mertz Library,LuEsther Mertz,Biodiversity Heritage Library Consortium
Hengeler Mueller Library,Hengeler Mueller,Common Library Network
Nicolas Born,Nicolas Born,Common Library Network
Biblioteca Franco Serantini,Franco Serantini,Fédération internationale des centres d'études et de documentation libertaires
Nordhausen Public Library,Rudolf Hagelstange,Common Library Network
King Abdul Aziz Public Library,Ibn Saud,World Digital Library
Library of the Free,Die Freien,Fédération internationale des centres d'études et de documentation libertaires
Duchess Anna Amalia Library,Duchess Anna Amalia of Brunswick-Wolfenbüttel,Common Library Network
