col0,col1,col2,col3,col4
Vdara,United States of America,MGM Resorts International,resort,Nevada
Walt Disney World Resort,United States of America,"Disney Parks, Experiences and Products",resort,Lake Buena Vista
Walt Disney World Resort,United States of America,"Disney Parks, Experiences and Products",tourist attraction,Lake Buena Vista
The Windsor Hotel Toya Resort & Spa,Japan,Meiji Shipping,hotel,Abuta District
Excalibur Hotel and Casino,United States of America,MGM Resorts International,hotel,Nevada
