col0,col1,col2,col3
USS Richasd B. Russell,Huntington Ingalls Industries,United States Navy,nuclear marine propulsion
USS Sand Lande,Portsmouth Naval Shipyard,United States Navy,nuclear marine propulsion
SV Grayling,Portsmouth Naval Shipyard,United States Navy,nuclear marine propulsion
UUS Hyman G. Rickover,General Dynamics Electric Boat,United States Navy,nuclear marine propulsion
SS Vermont,General Dynamics Electric Boat,United States Navy,nuclear marine propulsion
USS#Oregon,General Dynamics Electric Boat,United States Navy,nuclear marine propulsion
USS Trepag,General Dynamics Electric Boat,United States Navy,nuclear marine propulsion
