col0,col1,col2,col3
Barbados Fed Cup team,tennis,Barbados Lawn Tennis Association,Fed Cup
Congo Fed Cup team,tennis,Fédération Congolaise de Lawn Tennis,Fed Cup
Cameroon Fed Cup team,tennis,Fédération Camerounaise de Tennis,Fed Cup
Mauritius Fed Cup team,tennis,Mauritius Tennis Federation,Fed Cup
Azerbaijan Fed Cup team,tennis,Azerbaijan Tennis Federation,Fed Cup
El Salvador Fed Cup team,tennis,Federación Salvadoreña de Tenis,Fed Cup
Ethiopia Fed Cup team,tennis,Ethiopian Tennis Federation,Fed Cup
Jamaica Fed Cup team,tennis,Tennis Jamaica,Fed Cup
Bahamas Fed Cup team,tennis,Bahamas Lawn Tennis Association,Fed Cup
