col0,col1,col2,col3,col4,col5
Rottenburg University of Applied Forest Sciences,1979-01-01,Library of Rottenburg University of Applied Forest Sciences,Germany,Rottenburg am Neckar,110
University of Applied Sciences Neu-Ulm,1994-01-01,Library of the University of Applied Sciences Neu-Ulm,Germany,Neu-Ulm,345
Leipzig University of Applied Science,1992-01-01,Library of the Leipzig University of Applied Sciences,Germany,Leipzig,179
Fachhochschule Kiel,1969-01-01,Computermuseum der Fachhochschule Kiel,Germany,Neumühlen-Dietrichsdorf,466
Schmalkalden University of Applied Sciences,1991-01-01,Cellarius library Schmalkalden,Germany,Schmalkalden,227
University of Applied Sciences Meissen,1992-01-01,Library of University of Applied Sciences Meissen,Germany,Meissen,86
Hochschule Stralsund,1991-01-01,Library of the University of Applied Sciences Stralsund,Germany,Stralsund,240
