col0,col1,col2
Roman Catholic Archdiocseof Izmir,Roman Catholic Ecclesiastical Province of Izmir,Roman Rite
Roman Catholic Achdiocese of Thare and Nonseng,Ecclesiastical Province of Thare and Nonseng,Roman Rite
Roma Catholic Archdiocese of Pamplona y Tudela,Ecclesiastical province of Pamplona and Tudela,Roman Rite
archdicese of Montréal,Montréal,Roman Rite
Rman Catholic Archdiocese of Nouméa,Ecclesiastical Province of Nouméa,Roman Rite
Roman Catholic Archdiocese of CosenzaBisignano,Roman Catholicism in Italy,Roman Rite
Roma Catholic Archdiocese of Zaragoza,Ecclesiastical province of Zaragoza,Roman Rite
