col0,col1,col2,col3
Haley Lake Migratory Bird Sanctuary,1980-01-01,Shelburne County,Canadian Wildlife Service
Sable River Migratory Bird Sanctuary,1941-01-01,Shelburne County,Canadian Wildlife Service
Upper Canada Migratory Bird Sanctuary,1961-01-01,"United Counties of Stormont, Dundas and Glengarry",Canadian Wildlife Service
Port Hebert Migratory Bird Sanctuary,1941-01-01,Queens County,Canadian Wildlife Service
Mississippi Lake Migratory Bird Sanctuary,1959-01-01,Lanark County,Canadian Wildlife Service
