col0,col1,col2,col3
Helmholtz-Zentrum Dresden-Rossendorf,Helmholtz Association of German Research Centres,1992-01-01,Dresden-concept
Leibniz Center for Informatics,Leibniz Association,1989-01-01,Kaiserslautern-Saarbrücken Computer Science Cluster
German Research Center for Artificial Intelligence,World Wide Web Consortium,1988-01-01,Kaiserslautern-Saarbrücken Computer Science Cluster
Railway Technical Research Institute,International Union of Railways,1986-12-10,Japan Railways Group
Federal Institute for Risk Assessment,Working Group of the German Federal Departmental Research  Establishments,2002-01-01,"Federal Ministry of Food, Agriculture and Consumer Protection"
Bundesinstitut für Kultur und Geschichte der Deutschen im östlichen Europa (Germany),Working Group of the German Federal Departmental Research  Establishments,1989-01-01,University of Oldenburg
Bundesanstalt für Strassenwesen,Working Group of the German Federal Departmental Research  Establishments,1951-01-01,Federal Ministry of Transport and Digital Infrastructure
Institut für Arbeitsmarkt- und Berufsforschung,Working Group of the German Federal Departmental Research  Establishments,1967-01-01,Federal Employment Agency of Germany
Ferdinand-Braun-Institut,Leibniz Association,1992-01-01,Forschungsverbund Berlin
