col0,col1,col2,col3
Banner Good Samaritan Medical Center,medical organization,Banner Health,Phoenix
Alta Bates Summit Medical Center - Oakland,medical organization,Alta Bates Summit Medical Center,Oakland
William Beaumont Hospital,medical organization,Beaumont Health,Troy
Universitäts-Frauenklinik des Saarlandes,medical organization,Saarland University Medical Center,Homburg
Banner Good Samaritan Medical Center,medical facility,Banner Health,Phoenix
Shriners Hospitals for Children - Erie,hospital,Shriners Hospitals for Children,Erie
Yeovil District Hospital,hospital,Yeovil District Hospital NHS Foundation Trust,Yeovil
