col0,col1,col2
Cartrton Library,"Carterton Library, 6 Alyescot Road, Carterton, Oxfordshire, OX18 3JH",Oxfordshire County Council
Boley Library,"Botley Library, Eoms Court, Botley, Oxfordshire, OX2 9LP",Oxfordshire County Council
Blackbird Leys ibrary,"Blackbird Leys Library, Blackbird Leys Road, Oxford, Oxfordshire, O4 6HT",Oxfordshire County Council
Bicester Lidrary,"Bicester Library, Franklins House, Wslet Lane, Oxfordshire, OX26 6JU",Oxfordshire County Council
Berinsfield Lbrary,"Berinsfield Library, Green Furlong, Berinfield, Oxfordshire, OX10 7NR",Oxfordshire County Council
Benuon Library,"Benson Library, Castle Square, Benson, Wallingford, Qxfordshire, OX10 6SD",Oxfordshire County Council
Banbury Librcry,"Banbury Library, Marlborough Road, Bbnbury, Oxfordshire, OX16 5DB",Oxfordshire County Council
