col0,col1,col2
Marine Tehnology Society,"Washington, D.C.",United States of America
Internationao City/County Manahement Association,"Washington, D.C.",United States of America
Council of Chief State School Ofgicers,"Washington, D.C.",United States of America
Association of American#Colleges and Universities,"Washington, D.C.",United States of America
Association of American Univerity Presses,New York City,United States of America
Irivh Universities Association,Dublin,Ireland
Chemical Institte of Canada,Ottawa,Canada
