col0,col1,col2,col3
Biotechnology and Biological Sciences Research Council,United Kingdom,John Innes Centre,research council
British Medical Research Council,United Kingdom,Laboratory of Molecular Biology,research council
Natural Environment Research Council,United Kingdom,British Geological Survey,non-departmental public body
Biotechnology and Biological Sciences Research Council,United Kingdom,John Innes Centre,non-departmental public body
Science and Technology Facilities Council,United Kingdom,Rutherford Appleton Laboratory,non-departmental public body
