col0,col1,col2,col3,col4
"St Andrew's College, Cambridge",Cambridge,United Kingdom,"89 Regent Street, Cambridge, CB2 1AW, UK",boarding school
Westbrook Hay Prep School,Hemel Hempstead,United Kingdom,"London Road, Hemel Hempstead, Hertfordshire, HP1 2RF, England",independent school
Royal Russell School,Croydon,United Kingdom,"Coombe Lane, Croydon, UK",independent school
Royal Grammar School,Guildford,United Kingdom,"High Street, Guildford, Surrey, GU1 3BB",grammar school
Royal Russell School,Croydon,United Kingdom,"Coombe Lane, Croydon, UK",school
