col0,col1,col2,col3
Madera South High School,Madera Unified School District,2006-01-01,state school
Martin Luther King High School,Riverside Unified School District,1999-08-01,high school
Madera South High School,Madera Unified School District,2006-01-01,high school
Lebanon High School,Lebanon City School District,2004-01-01,state school
Lansdowne High School,Baltimore County Public Schools,1963-01-01,state school
La Quinta High School,Desert Sands Unified School District,1994-01-01,state school
John Hay High School,Cleveland Metropolitan School District,1929-01-01,state school
John Glenn High School,Norwalk–La Mirada Unified School District,1962-01-01,state school
Lebanon High School,Lebanon City School District,2004-01-01,high school
