col0,col1,col2,col3
International Business School Groningen,Hochschule,"Hanze University of Applied Sciences, Groningen",Groningen
Faculty of Economics and Business Administration of Iasi,faculty of economics,Alexandru Ioan Cuza University,Iași
Manning School of Business,business school,University of Massachusetts Lowell,Massachusetts
Deusto Business School,business school,University of Deusto,Bilbao
Faculty of Economics and Business Administration of Iasi,business school,Alexandru Ioan Cuza University,Iași
