col0,col1,col2,col3,col4
Army Maintenance and Motor School,Sweden,Skövde Garrison,Army Motor School,Swedish Army
Naval Warfare Centre,Sweden,Karlskrona Garrison,Swedish Navy Schooner Division,Swedish Navy
Swedish Armed Forces Technical School,Sweden,Halmstad Garrison,Swedish Air Force School of Technology,Swedish Armed Forces
Halmstad Armed Forces Shools,Sweden,Halmstad Garrison,Swedish Air Force School of Technology,Swedish Armed Forces
Swedish Armed Forces Technical School,Sweden,Halmstad Garrison,AIr Traffic Control School,Swedish Armed Forces
Halmstad Armed Forces Shools,Sweden,Halmstad Garrison,Swedish Air Force Weather School,Swedish Armed Forces
