col0,col1,col2,col3
George Eliot Hospital NHS Trust,United Kingdom,George Eliot Hospital,Nuneaton
Gloucestershire Care Services NHS Trust,United Kingdom,Stroud General Hospital,Gloucester
Royal Wolverhampton Hospitals NHS Trust,United Kingdom,New Cross Hospital,Wolverhampton
Solent NHS Trust,United Kingdom,Royal South Hants Hospital,Southampton
Portsmouth Hospitals NHS Trust,United Kingdom,Queen Alexandra Hospital,Portsmouth
Royal United Hospital Bath NHS Trust,United Kingdom,Royal United Hospital,Bath
East and North Hertfordshire NHS Trust,United Kingdom,Lister Hospital,Stevenage
Belfast Health and Social Care Trust,United Kingdom,Belfast City Hospital,Belfast
University Hospitals Coventry and Warwickshire NHS Trust,United Kingdom,University Hospital Coventry,Coventry
Birmingham Community Healthcare NHS Trust,United Kingdom,Birmingham Dental Hospital,Birmingham
Barts Health NHS Trust,United Kingdom,NIHR Barts Cardiovascular Biomedical Research Unit,London
"Barnet, Enfield and Haringey Mental Health NHS Trust",United Kingdom,St Ann’s Hospital,London
South West London and St George's Mental Health NHS Trust,United Kingdom,Richmond Royal Hospital,London
Barts Health NHS Trust,United Kingdom,Whipps Cross University Hospital,London
South West London and St George's Mental Health NHS Trust,United Kingdom,Springfield Hospital,London
