col0,col1,col2,col3,col4
University of Applied Sciences Leiden,Netherlands,Vereniging Hogescholen,Leiden,1984-01-01
Hogeschool van Amsterdam,Netherlands,Vereniging Hogescholen,Amsterdam,1993-01-01
Nordhausen University of Applied Sciences,Germany,German Rectors' Conference,Nordhausen,1997-01-01
THI - Technical University of  Applied Sciences in Ingolstadt,Germany,European University Association,Ingolstadt,1994-01-01
Center for Jewish Studies Heidelberg,Germany,German Rectors' Conference,Heidelberg,1979-01-01
