col0,col1,col2,col3
Thailand national handball team,men's handball,national handball team,handball
Congo DR national handball team,men's handball,national handball team,handball
Senegal national handball team,men's handball,national handball team,handball
Gabon national handball team,men's handball,national handball team,handball
Côte d'Ivoire national handball team,men's handball,national handball team,handball
Iran national handball team,men's handball,national handball team,handball
Faroe Islands national handball team,men's handball,national handball team,handball
Turkey national handball team,men's handball,national handball team,handball
Estonia national handball team,men's handball,national handball team,handball
