col0,col1,col2
Beata Vergine della Misericordia (Terrassa Padovana),Terrassa Padovana,Roman Catholic Diocese of Padua
Madonna della Pace,Massa Martana,Roman Catholic Diocese of Orvieto-Todi
Santuario della Beata Vergine Assunta di Loreto,Oleggio,Roman Catholic Diocese of Novara
santuario  Sant'Agnello Abate,Roccarainola,Roman Catholic Diocese of Nola
Sanctuary of the Villa Virgin,Martos,Roman Catholic Diocese of Jaén
"Santuario del Signore della città (Caltanissetta, Italy)",Caltanissetta,Roman Catholic Diocese of Caltanissetta
