col0,col1,col2
Obabika River Provincial Park,Sudbury District,Ontario Parks
Missinaibi Provincial Park,Sudbury District,Ontario Parks
Killarney Provincial Park,Sudbury District,Ontario Parks
Fairbank Provincial Park,Greater Sudbury,Ontario Parks
Killarney Lakelands and Headwaters Provincial Park,Greater Sudbury,Ontario Parks
J. Albert Bauer Provincial Park,Muskoka District Municipality,Ontario Parks
Oxtongue River-Ragged Falls Provincial Park,Muskoka District Municipality,Ontario Parks
Bigwind Lake Provincial Park,Muskoka District Municipality,Ontario Parks
Queen Elizabeth II Wildlands Provincial Park,Muskoka District Municipality,Ontario Parks
Wheatley Provincial Park,Chatham-Kent,Ontario Parks
Sibbald Point Provincial Park,Regional Municipality of York,Ontario Parks
