col0,col1,col2,col3,col4
Indian states,paper,Harvard Library,India,Institute of Geographical Exploration
Landforms of China,paper,Harvard Library,People's Republic of China,Institute of Geographical Exploration
Map of the Landforms of the United States,paper,Harvard Library,United States of America,Institute of Geographical Exploration
Landform map of England,paper,Harvard Library,Wales,Institute of Geographical Exploration
Landform map of Canada,paper,Harvard Library,Canada,Institute of Geographical Exploration
"Map of old Cambridge, in the vicinity of Harvard University",paper,Harvard Library,Cambridge,Phillips Brooks House Association
Landforms of Oregon,paper,Harvard Library,Oregon,Oregon Department of Geology and Mineral Industries
Greater Antilles,paper,Harvard Library,West Indies,Erwin Raisz
