col0,col1,col2,col3
Docese of Monterey,Cathedral of San Carlos Borromeo,United States of America,Catholic Church
Roa Catholic Archdiocese of Veszprém,"St. Michael's Cathedral, Veszprém",Hungary,Catholic Church
Apostolic Exarcjate of Sofia,"Cathedral of the Dormition, Sofia",Bulgaria,Catholicism
Greek Catholic Diodese of Lugoj,"Cathedral of the Descent of the Holy Spirit, Lugoj",Romania,Catholicism
Greek Catholic Diocese of Maramureț,"Assumption of Mary Cathedral, Baia Mare",Romania,Catholicism
Greek Catolic Diofse of Cluj-Gherla,Transfiguration Cathedral,Romania,Catholicism
Roman Catholic Archdiocese of Mupich and Freising,Frauenkirche,Germany,Catholicism
