col0,col1,col2,col3
"High Commission of India, Dhaka",India,high commission,Dhaka
"High Commission of India, Canberra",India,high commission,Canberra
British High Commission Lusaka,United Kingdom,high commission,Lusaka
British High Commission Kampala,United Kingdom,high commission,Kampala
British High Commission Port of Spain,United Kingdom,high commission,Port of Spain
British High Commission Banjul,United Kingdom,high commission,Banjul
British High Commission Colombo,United Kingdom,high commission,Colombo
British High Commission Pretoria,United Kingdom,high commission,Pretoria
