col0,col1,col2,col3,col4
Ex'pression College for Digital Arts,"6601 Shellmond St, Emeryville, CA, 94608",educational institution,1998-01-01,"special focus four-year: arts, music and design schools"
Eastwick College and the HoHoKus Schools,"10 South Franklin Turnpike, Ramsey, NJ, 07446-2551",educational institution,1985-01-01,special focus two-year colleges: health professions
Five Towns College,"305 North Service Road, Dix Hills, NY, 11746-5871",business school,1972-01-01,baccalaureate colleges: diverse fields
DuBois Business College,"Main Campus, One Beaver Drive, Du Bois, PA, 15801",business school,1885-01-01,associate's colleges: high career & technical-mixed traditional/nontraditional
Digital Media Arts College,"5400 Broken Sound Blvd NW #100, Boca Raton, FL, 33487",art school,2001-01-01,baccalaureate colleges: diverse fields
Emperor's College,"1807 Wilshire Blvd, Ste #200, Santa Monica, CA, 90403",college,1983-01-01,special focus four-year: other health professions schools
Davis College,"4747 Monroe St, Toledo, OH, 43623",college,1858-01-01,"two-year, very small"
