col0,col1,col2,col3
"Ministry of Popular Power for Interior, Justice and Peace",Caracas,1832-01-01,Gustavo González López
Ministry of the Interior and Safety,Government Complex Seoul,2017-07-26,Kim Boo-kyum
Ministry of the Interior of the Czech Republic,Prague,1969-01-01,Jan Hamáček
Ministry of the Interior,paseo de la Castellana,1996-01-01,Fernando Grande-Marlaska
"Ministry of Popular Power for Interior, Justice and Peace",Caracas,1832-01-01,Néstor Reverol
Ministry of Interior of the Islamic Republic of Iran,Toopkhaneh,1901-01-01,Abdolreza Rahmani Fazli
Ministry of Internal Affairs,"Revolution Square, Bucharest",1862-07-16,Gabriel Oprea
