col0,col1,col2,col3
Center for Inquiry,Humanists International,organization,501(c)(3) organization
Freedom From Religion Foundation,Humanists International,organization,501(c)(3) organization
American Humanist Association,Humanists International,organization,501(c)(3) organization
Bund Deutscher Landschaftsarchitekten,German alliance for nature conservation,association,registered association
Confederation of German Employers' Associations,European Movement Germany,association,registered association
Bund für Umwelt und Naturschutz Deutschland,Association for the Taxation of Financial Transactions and for Citizens' Action,association,registered association
Deutsche Filmakademie,Vertrauensstelle gegen sexuelle Belästigung,association,registered association
