col0,col1,col2,col3
Communist Party of Belgium,communist party,far-left,Brussels-Capital Region
Marxist–Leninist Party of Germany,communist party,far-left,Gelsenkirchen
Communist Party of Spain,communist party,left-wing,Madrid
Movement of Unitarian Communists,communist party,left-wing,Rome
Italian Communist Party,communist party,left-wing,Rome
Communist Party of Vietnam,communist party,left-wing,Ba Đình
Communist Party of Cuba,communist party,far-left,Havana
Communist Party USA,communist party,far-left,New York City
French Communist Party,communist party,left-wing,Headquarters of the French Communist Party
