col0,col1,col2,col3
Alameda Health System,United States of America,Alameda Hospital,Oakland
Saskatoon Health Region,Canada,Royal University Hospital,Saskatoon
University of Maryland Medical System,United States of America,Baltimore Washington Medical Center,Baltimore
St Vincent's Health Australia,Australia,"St Vincent's Hospital, Melbourne",Melbourne
West Hertfordshire Hospitals NHS Trust,United Kingdom,Watford General Hospital,Watford
University Hospitals Birmingham NHS Foundation Trust,United Kingdom,Queen Elizabeth Hospital Birmingham,Birmingham
Institut Catalan de la Santé,Spain,Hospital de Bellvitge,Barcelona
Allegheny Health Network,United States of America,Allegheny General Hospital,Pittsburgh
Central Manchester University Hospitals NHS Foundation Trust,United Kingdom,Manchester Royal Infirmary,Manchester
