col0,col1,col2,col3
Zurmi,supervisory councillors of Zurmi local government,Chairman of Zurmi local government,Zurmi legislative council
Zangon Kataf,supervisory councillors of Zangon-Kataf local government,Chairman of Zangon-Kataf local government,Zangon-Kataf legislative council
Wasagu/Danko,supervisory councillors of Wasagu/Danko local government,Chairman of Wasagu/Danko local government,Wasagu/Danko legislative council
Warri South,supervisory councillors of Warri South local government,Chairman of Warri South local government,Warri South legislative council
Ughelli North,supervisory councillors of Ughelli North local government,Chairman of Ughelli North local government,Ughelli North legislative council
Toro,supervisory councillors of Toro local government,Chairman of Toro local government,Toro legislative council
