col0,col1,col2,col3,col4
North East Surrey Secondary Short Stay School,Hersham,Pupil Referral Unit,Surrey,United Kingdom
Poplar Adolescent Unit,Rochford,Pupil Referral Unit,Essex,United Kingdom
Hawkswood Primary PRU,Chingford,Pupil Referral Unit,London Borough of Waltham Forest,United Kingdom
Maidstone and Malling Alternative Provision,Maidstone,Pupil Referral Unit,Kent,United Kingdom
Southwark Inclusive Learning Service,Peckham,Pupil Referral Unit,London Borough of Southwark,United Kingdom
Sutton Tuition and Reintegration Service,Carshalton,Pupil Referral Unit,London Borough of Sutton,United Kingdom
Pilgrim PRU,Fulbourn,Pupil Referral Unit,Cambridgeshire,United Kingdom
CCfL Key Stage 3 PRU,London,Pupil Referral Unit,London Borough of Camden,United Kingdom
Ealing Primary Centre,Greenford,Pupil Referral Unit,London Borough of Ealing,United Kingdom
Milton Keynes Primary Pupil Referral Unit,Bletchley,Pupil Referral Unit,Milton Keynes,United Kingdom
New River College Medical,London,Pupil Referral Unit,London Borough of Islington,United Kingdom
The St Aubyn Centre Education Department,Colchester,Pupil Referral Unit,Essex,United Kingdom
The Surrey Teaching Centre,Tadworth,Pupil Referral Unit,Surrey,United Kingdom
The Key Education Centre,Gosport,Pupil Referral Unit,Hampshire,United Kingdom
Will Adams Centre,Gillingham,Pupil Referral Unit,Medway,United Kingdom
