col0,col1,col2
Chaos Computer Club,European Digital Rights,registered association
Bund Deutscher Landschaftsarchitekten,German alliance for nature conservation,registered association
Deutscher Frauenrat,Bundesnetzwerk B체rgerschaftliches Engagement,registered association
Arbeitsgemeinschaft Literarischer Gesellschaften und Gedenkst채tten,Bundesnetzwerk B체rgerschaftliches Engagement,registered association
Gesellschaft Deutscher Chemiker,Deutsche Vereinigung des Gas- und Wasserfaches,registered association
German Mathematical Society,International Mathematical Union,registered association
Lebenshilfe Deutschland,Arbeitsgemeinschaft f체r Kinder- und Jugendhilfe,registered association
Confederation of German Employers' Associations,European Movement Germany,registered association
