col0,col1,col2
Himachal Pradesh Legislative Assembly,Member of the Himachal Pradesh Legislative Assembly,Government of Himachal Pradesh
Kerala Legislative Assembly,Member of the Kerala Legislative Assembly,Government of Kerala
Punjab Legislative Assembly,Member of the Punjab Legislative Assembly,Government of Punjab
Sikkim Legislative Assembly,Member of the Sikkim Legislative Assembly,Government of Sikkim
Assam Legislative Assembly,Member of the Assam Legislative Assembly,Government of Assam
