col0,col1,col2,col3
New Hampshire Wildcats women's basketball,Wildcats,1975-01-01,Lundholm Gym
Dartmouth Big Green women's basketball,Big Green,1972-01-01,Leede Arena
Santa Clara Broncos women's basketball,Broncos,1963-01-01,Leavey Center
Nevada Wolf Pack women's basketball,Wolf Pack,1981-01-01,Lawlor Events Center
Campbell Fighting Camels women's basketball,Fighting Camels,1972-01-01,"John W. Pope, Jr. Convocation Center"
Davidson Wildcats women's basketball,Wildcats,1973-01-01,John M. Belk Arena
San Diego Toreros women's basketball,Toreros,1980-01-01,Jenny Craig Pavilion
