col0,col1,col2
Campeonato Nacional de Fútbol de Cuba,Football Association of Cuba,1912-01-01
Elite Two,Fédération Camerounaise de Football,1961-01-01
Vietnamese Second Division,Vietnam Football Federation,2001-01-01
Torneo de Reservas de la Liga Nacional de Honduras,National Autonomous Federation of Football of Honduras,1966-01-01
Montenegrin Women's League,Football Association of Montenegro,2011-01-01
Moldovan women's football championship,Football Association of Moldova,1996-01-01
"Moldovan ""B"" Division",Football Association of Moldova,1992-01-01
