col0,col1,col2
Kharua Uajapur High School,1962/01/01,Bangaon community development block
Ganrapova Hig School,1954/01/01,Bangaon community development block
SN SS Irinjalakuda,1964/01/01,Thrissur district
Hri Sri Vidya Nidhi School,1978/01/01,Thrissur district
Carmel Highe Secondary School Chaakudy,1975/01/01,Thrissur district
VPM SNDP Higher Secpndary School,1916/01/01,Thrissur district
St. Paul's Convent Englsh Higher Secondary School,1964/01/01,Thrissur district
St. Joveph' Model Higher Secondary School,1961/01/01,Thrissur district
Seventh Day Adventist Higher Sefondary School Thrissur,1973/01/01,Thrissur district
