col0,col1,col2
University of Iowa College of Law,Iowa,University of Iowa
Texas A&M University School of Law,Fort Worth,Texas A&M University
USC Gould School of Law,Los Angeles,University of Southern California
Osgoode Hall Law School,Toronto,York University
City University of New York School of Law,New York,City University of New York
Georgetown University Law Center,"Washington, D.C.",Georgetown University
University of Michigan Law School,Washtenaw County,University of Michigan
UC Berkeley School of Law,California,"University of California, Berkeley"
