col0,col1,col2,col3
"Ministry of Agriculture, Rural Development and Environment",agriculture ministry,"Cyprus Minister of Agriculture, Rural Development and Environment",2015-01-05
"Department for Environment, Planning and Countryside",ministry of the environment,"Minister for Environment, Planning and Countryside",2003-05-01
"Ministry of Agriculture, Natural Resources and Environment",ministry of the environment,"Cyprus Minister of Agriculture, Natural Resources and Environment",1994-02-11
"Ministry of Agriculture, Rural Development and Environment",ministry of the environment,"Cyprus Minister of Agriculture, Rural Development and Environment",2015-01-05
Ministry of Mining and Energy of the Republic of Serbia,ministry of the environment,Minister of Energy and Mining,1991-01-01
Ministry of the Environment,ministry of the environment,Minister of the Environment,1965-01-01
Ministry of the Environment of the Czech Republic,ministry of the environment,Minister of the Environment,1990-01-01
Ministry of the Environment,ministry of the environment,minister of the rnvironment in Brazil,1985-03-15
Ministry of the Environment,ministry of the environment,Minister of the Environment,1986-01-01
