col0,col1,col2,col3,col4
Communauté de communes Xaintrie Val'Dordogne,12013,community of communes,Communauté de communes du Canton de Mercœur,Argentat-sur-Dordogne
Communauté de communes de la Porte des Vosges Méridionales,30624,community of communes,Communauté de communes des Vosges Méridionales,Saint-Étienne-lès-Remiremont
Communauté de communes des Lacs et Montagnes du Haut-Doubs,16124,community of communes,Communauté de communes des Hauts du Doubs,Les Hôpitaux-Vieux
Intercom Bernay Terres de Normandie,57513,community of communes,Communauté de communes du Canton de Broglie,Bernay
Communauté de communes du Vexin Normand,33047,community of communes,Communauté de communes Gisors-Epte-Lévrière,Gisors
Communauté de communes Lyons Andelle,21185,community of communes,Communauté de communes du canton de Lyons-la-Forêt,Charleval
Communauté de communes Couserans-Pyrénées,30819,community of communes,Communauté de communes du Castillonnais,Saint-Lizier
Communauté de communes Ardèche Rhône Coiron,22919,community of communes,Communauté de communes Barrès-Coiron,Cruas
