col0,col1,col2,col3
Royal Society of Chemistry,United Kingdom,Burlington House,"ORCID, Inc."
German Bar Association,German Reich,Berlin,IRZ-Foundation
German Association of Judges,Germany,Berlin,IRZ-Foundation
German Bar Association,German Reich,Berlin,International association of lawyers
association of swiss archivists,Switzerland,Urtenen-Schönbühl,Société suisse d'histoire
German Bar Association,German Reich,Hamburg,Association internationale des jeunes avocats
association of swiss archivists,Switzerland,Urtenen-Schönbühl,International Council on Archives
