col0,col1,col2,col3
Tuskegee University,Tuskegee,Tuskegee University Campus Cemetery,1880-01-01
John Carroll University,University Heights,John Carroll University North Quad Historic District,1886-01-01
Hofstra University,Nassau County,Hofstra College of Liberal Arts & Sciences,1935-01-01
Monterrey Institute of Technology and Higher Education,Monterrey,"Monterrey Institute of Technology and Higher Education, Aguascalientes",1943-09-06
Hofstra University,Nassau County,Fred DeMatteis School of Engineering and Applied Science,1935-01-01
Chapman University,California,Thurmond Clarke Memorial Library,1861-01-01
Hofstra University,Nassau County,Hofstra University Museum,1935-01-01
Morehouse College,Atlanta,Pitzer College,1867-01-01
