col0,col1,col2,col3
"General Administration of Quality Supervision, Inspection and Quarantine",Haidian District,government agency,2001-04-01
China Food and Drug Administration,Beijing,government agency,1950-01-01
Food Safety and Inspection Service,"Washington, D.C.",government agency,1977-01-01
Food Safety and Standards Authority of India,New Delhi,government agency,2011-08-01
Food Safety Authority of Ireland,Dublin,government agency,1999-01-01
Catalan Food Safety Agency,Barcelona,government agency,2002-06-27
