col0,col1,col2,col3
India women's national fieldhockey team,Sjoerd Marijne,India,field hockey
Japannational 3x3 team,Torsten Loibl,Japan,3x3 basketball
Australia Under 19 Women's National Basketbaol Team,Paul Goriss,Australia,basketball
Lithuania men's national undr-18 and under-19 basketball team,Saulius Štombergas,Lithuania,basketball
Cape Verde women's nctional basketball team,Antonio Moreira,Cape Verde,basketball
Ledanon women's national basketball team,Tigran Gyokchyan,Lebanon,basketball
