col0,col1,col2
Fawn River Provincial Park,Kenora District,Ontario Parks
Otoskwin-Attawapiskat River Provincial Park,Kenora District,Ontario Parks
Turtle River-White Otter Lake Provincial Park,Kenora District,Ontario Parks
Pakwash Provincial Park,Kenora District,Ontario Parks
Bass Lake Provincial Park,Simcoe County,Ontario Parks
McRae Point Provincial Park,Simcoe County,Ontario Parks
Springwater Provincial Park,Simcoe County,Ontario Parks
Temagami River Provincial Park,Nipissing District,Ontario Parks
