col0,col1,col2,col3,col4,col5
Deeside Sixth Library,Connah's Quay,further education library,Deeside College,17.0,Coleg Cambria
"Connahs Quay Library, Coleg Cambria",Connah's Quay,further education library,Deeside College,17.6,Coleg Cambria
"Yale Wrexham Library, Coleg Cambria",Wrexham,further education library,Yale College,90.8,Coleg Cambria
Coleg Meirion Dwyfor Pwllheli Library,Pwllheli,further education library,Coleg Meirion-Dwyfor,47.1,Grwp Llandrillo Menai
Coleg Meirion Dwyfor Glynllifon Library,Stable Courtyard At Glynllifon,further education library,Coleg Meirion-Dwyfor,32.3,Grwp Llandrillo Menai
Coleg Meirion Dwyfor Dolgellau Library,Dolgellau,further education library,Coleg Meirion-Dwyfor,13.0,Grwp Llandrillo Menai
