col0,col1,col2,col3
Gordon State College,3495,public educational institution of the United States,University System of Georgia
Georgia Southwestern State University,2950,public educational institution of the United States,University System of Georgia
Gordon State College,3495,university,University System of Georgia
Georgia Southwestern State University,2950,university,University System of Georgia
College of William & Mary,8484,public research university,Oak Ridge Associated Universities
City College of New York,15402,public educational institution of the United States,City University of New York
"California State University, Bakersfield",8700,public educational institution of the United States,California State University
Chicago State University,7100,public educational institution of the United States,American Association of State Colleges and Universities
