col0,col1,col2
NH Collection Turin Piazza Carlina,Italy,Historic Hotels Worldwide
San Clemente Palace Kempinski,Italy,Historic Hotels Worldwide
NH Collection Venice Palazzo Barocci,Italy,Historic Hotels Worldwide
Hotel Papadopoli Venezia - MGallery by Sofitel,Italy,Historic Hotels Worldwide
"Aleph Rome Hotel, Curio Collection by Hilton",Italy,Historic Hotels Worldwide
Hotel Villa Cipriani,Italy,Historic Hotels Worldwide
NH Collection Florence Porta Rossa,Italy,Historic Hotels Worldwide
Kempinski Hotel Cathedral Square,Lithuania,Historic Hotels Worldwide
Sofitel Grand Sopot,Poland,Historic Hotels Worldwide
