col0,col1,col2,col3
Narula Institute of Technology,2500,India,English
Institut national des sciences appliquées Centre Val de Loire,1660,France,French
Institut Polytechnique UniLaSalle,2330,France,English
École pour l'informatique et les techniques avancées,1789,France,English
Groupe INSA,15000,Morocco,French
École Nationale Supérieure d'Ingénieurs en Informatique Automatique Mécanique Énergétique Électronique,901,France,French
École d'ingénieurs Paoli Tech,55,France,French
Institut Polytechnique UniLaSalle,2330,France,French
Hautes études d'ingénieur,1690,France,French
EPF - Graduate Shool of Engineering,2200,France,French
Arts et Métiers ParisTech,5512,France,French
Institut National des Sciences Appliquées de Rennes,1756,France,French
École pour l'informatique et les techniques avancées,1789,France,French
