col0,col1,col2,col3
Ministry of Economic Affairs and Communications,ministry of communications,Minister of Economic Affairs and Communications,Estonia
Federal Ministry for Economic Affairs and Energy,energy ministry,Minister of Economic Affairs,Germany
Ministry of Public Administration and Local-Self Government of the Republic of Serbia,finance ministry,Ministry of Finance of the Republic of Serbia,Serbia
"Ministry of the Economy, Finances and Industry",finance ministry,"Minister of the Economy, Finances and Industry",France
Ministry of Economy and Finance,finance ministry,Italian Minister of Economy and Finance,Italy
"Ministry of the Economy, Finances and Industry",ministry of France,"Minister of the Economy, Finances and Industry",France
Ministry of Economy and Finance,Ministry of Spain,Minister of Finance and Public Administrations,Spain
Ministry of Economic Affairs and Employment,ministry of Industry,Minister of Economic Affairs,Finland
