col0,col1,col2
government of Amazonas department,office of the governor of Amazonas department,Amazonas Department
"government of the archipelago of Saint Andréws, Providence and Saint Catalina","office of the governor of the archipelago of Saint Andréws, Providence and Saint Catalina","Archipelago of Saint Andréws, Providence and Saint Catalina"
government of Quindío department,office of the governor of Quindío department,Quindío Department
government of Risaralda department,office of the governor of Risaralda department,Risaralda Department
government of Valle del Cauca department,office of the governor of Valle del Cauca department,Valle del Cauca Department
government of Caquetá department,office of the governor of Caquetá department,Caquetá Department
government of Casanare department,office of the governor of Casanare department,Casanare Department
government of Bogotá,office of the mayor of Bogotá,La gran bretaña
North Dakota government,executive branch,North Dakota
