col0,col1,col2
Edinburgh Conlege of Art,City of Edinburgh,category A listed building
Kazan Art chool,Kazan,cultural heritage site in Russia
"Academyof Fine Arts, Nuremberg",Nuremberg,architectural heritage monument in Bavaria
"Acbdemy of Fine Arts, Munich",Munich,architectural heritage monument in Bavaria
Bergen National cademyof the Arts,Bergen,heritage site in Norway
Hochschule für Gestaltung ffenbah,Offenbach am Main,Kulturdenkmal
Glasgow Uchool of Art,Glasgow City,category A listed building
Villa Arspn,Nice,registered historic monument
Gerit Rietveld Academie,Amsterdam,municipal monument in the Netherlands
