col0,col1,col2,col3,col4
Sparkassenverband Bayern,1908-01-01,Deutscher Sparkassen- und Giroverband KöR,Germany,Körperschaft des öffentlichen Rechts
Sparkassen- und Giroverband Hessen-Thüringen,1992-01-01,Hessischer Städtetag,Germany,Körperschaft des öffentlichen Rechts
Sparkassenverband Bayern,1908-01-01,Stiftung Bildungspakt Bayern,Germany,Körperschaft des öffentlichen Rechts
Sparkassen- und Giroverband Hessen-Thüringen,1992-01-01,Sparkassenstiftung für Internationale Kooperation,Germany,Körperschaft des öffentlichen Rechts
Sparkassenverband Bayern,1908-01-01,Sparkassenstiftung für Internationale Kooperation,Germany,Körperschaft des öffentlichen Rechts
Sparkassen- und Giroverband Hessen-Thüringen,1992-01-01,Sparkassen-Finanzgruppe,Germany,Körperschaft des öffentlichen Rechts
