col0,col1,col2,col3
The Jesus Big Power Cofraditeision,Catholicism,León,Spain
Hermandad de la Virgen de la Esperanza,Latin Church,Valdemorillo,Spain
Santa y Real Hermandad de Nuestra Señora del Refugio y Piedad de Zaragoza,Latin Church,Zaragoza,Spain
Brotherhood of the Star ((Jerez)),Catholic Church,Jerez de la Frontera,Spain
"Brotherhood of Saint March, Sevilla",Catholic Church,Seville,Spain
Hermandad del Cristo de San Agustín,Catholicism,Granada,Spain
Hermandad de los Estudiantes,Catholic Church,Seville,Spain
"Hermandad de la Redención, Sevilla",Catholic Church,Seville,Spain
