col0,col1,col2,col3,col4,col5,col6
Westminster Under School,City of Westminster,United Kingdom,1943-01-01,City of Westminster,preparatory school,London
The Mall School,London Borough of Richmond upon Thames,United Kingdom,1872-01-01,London Borough of Richmond upon Thames,preparatory school,Twickenham
Newton Preparatory School,London Borough of Wandsworth,United Kingdom,1991-11-14,London Borough of Wandsworth,preparatory school,London
New Park School,Fife,United Kingdom,1933-01-01,Fife,preparatory school,St Andrews
King's House School,London Borough of Richmond upon Thames,United Kingdom,1946-01-01,London Borough of Richmond upon Thames,preparatory school,Richmond
Hereward House School,London Borough of Camden,United Kingdom,1951-01-01,London Borough of Camden,preparatory school,London
Homefield Preparatory School,London Borough of Sutton,United Kingdom,1870-01-01,London Borough of Sutton,independent school,Sutton
Hanford School,North Dorset,United Kingdom,1947-01-01,North Dorset,independent school,Blandford Forum
Hill House International Junior School,City of Westminster,United Kingdom,1951-01-01,City of Westminster,independent school,Knightsbridge
