col0,col1,col2,col3,col4,col5
United States Air Force,military branch,United States of America,Operation Odyssey Dawn,United States Armed Forces,Limelite
People's Liberation Army Air Force,air force,People's Republic of China,Korean War,People's Liberation Army,Shek Kong Airfield
Portuguese Air Force,air force,Portugal,World War I,Portuguese Armed Forces,Museu do Ar
Royal Thai Air Force,air force,Thailand,World War I,Royal Thai Armed Forces,Thupatemee Stadium
Royal Air Force,air force,United Kingdom,World War II,British Armed Forces,Shek Kong Airfield
United States Air Force,air force,United States of America,Korean War,United States Armed Forces,Falcon Stadium
