col0,col1,col2,col3,col4,col5
Castrillón,Ángela Rosa Vallina Noval,UTC+01:00,mayor of Castrillón,22376,Piedras Blancas
Yernes y Tameza,José Ramón Fernández Díaz,UTC+01:00,mayor of Yernes y Tameza,132,Villabre
Santo Adriano,Jesús Muñiz Castro,UTC+01:00,mayor of Santo Adriano,288,Villanueva
Teverga,María Amor Álvarez Ardura,UTC+01:00,mayor of Teberga,1572,La Plaza
Carreño,Amelia Fernández López,UTC+01:00,mayor of Carreño,10337,Candás
Peñamellera Alta,Rosa María Domínguez de Posada Puertas,UTC+01:00,mayor of Peñamellera Alta,514,Alles
Casu,Miguel Ángel Fernández Iglesias,UTC+01:00,mayor of Caso,1507,El Campu
Cangues d'Onís,José Manuel González Castro,UTC+01:00,mayor of Cangas de Onís,6163,Cangas de Onís
Ibias,José Ron Méndez,UTC+01:00,mayor of Ibias,1251,San Antolín
