col0,col1,col2,col3
Ministry of Foreign Affairs,Sri Lanka,1948-01-01,"Republic Building, Colombo"
Federal Ministry for European and International Affairs,Austria,1920-11-20,Minoritenplatz
Ministry of Foreign Affairs of USSR,Soviet Union,1923-07-16,Ministry of Foreign Affairs of Russia main building
Ministry of Foreign Affairs of the Russian Federation,Russia,1991-12-25,Ministry of Foreign Affairs of Russia main building
Ministry of Foreign Affairs of Algeria,Algeria,1958-01-01,El Mouradia
