col0,col1,col2,col3
Narit Nyayratna Institution,Amta II community development block,Narit,declared heritage site by West Bengal Heritage Commission
Antiga Escola Normal Primária de Faro,Faro (Sé e São Pedro),São Pedro,heritage without legal protection
Escola Secundária Martins Sarmento,"Oliveira, São Paio e São Sebastião",Oliveira do Castelo,heritage without legal protection
Escola Primária do Cedro,Mafamude e Vilar do Paraíso,Mafamude,Monument of Public Interest
Colégio dos Meninos Orfãos,Santa Maria Maior,Socorro,Immovable Cultural Heritage of Public Interest
