col0,col1,col2,col3,col4,col5,col6
Gangwon Province municipal council,Gangwon Province,41,44,Chuncheon,Gangwon Province councilor,unicameral legislature
North Jeolla Province municipal council,North Jeolla Province,35,38,Wansan-gu,North Jeolla Province councilor,council
Jeju municipal council,Jeju Province,30,36,Jeju,Jeju councilor,council
North Chungcheong Province municipal council,North Chungcheong Province,29,31,Sangdang-gu,North Chungcheong Province councilor,council
South Chungcheong Province municipal council,South Chungcheong Province,37,40,Yesan County,South Chungcheong Province councilor,council
South Jeolla Province municipal council,South Jeolla Province,53,58,Muan County,South Jeolla Province councilor,council
