col0,col1,col2,col3
University of Toronto Mississauga Library,University of Toronto Mississauga,Mississauga,2006-01-01
Klimo Library,University of Pécs,Pécs,1774-01-01
Library of the Royal Institute of Asturian Studies,Royal Institute of Asturian Studies,Oviedo,1946-01-01
Gustav Landauer Library Witten,Anarchist archives,Witten,2011-12-01
Celia,Ministry of Education and Culture,Helsinki,1890-01-01
Department of Planned Languages and Esperanto Museum,Austrian National Library,Vienna,1927-01-01
Biblioteca Pública Episcopal,Roman Catholic Archdiocese of Barcelona,Barcelona,1772-01-01
Biblioteca del Teatro Colón,Teatro Colón,Buenos Aires,1940-01-01
