col0,col1,col2,col3,col4,col5
Order of the Garter,United Kingdom,Lady of the Garter,Brockhaus and Efron Encyclopedic Dictionary,Order of the Thistle,1348-01-01
Order of St. Olav,Norway,Knight Grand Cross with Collar of the Order of St. Olav,Brockhaus and Efron Encyclopedic Dictionary,Royal Norwegian Order of Merit,1847-08-21
Order of Aviz,Portugal,Knight of the Order of Aviz,Brockhaus and Efron Encyclopedic Dictionary,Order of Saint James of the Sword,1162-08-13
Order of the Bath,United Kingdom,Great Masters of the Order of the Bath,Brockhaus and Efron Encyclopedic Dictionary,Order of the Star of India,1725-01-01
Royal Order of the Sword,Sweden,Medal of the Sword,Brockhaus and Efron Encyclopedic Dictionary,Royal Order of the Polar Star,1748-02-23
