col0,col1,col2,col3,col4
Fuerza Nueva,Blas Piñar,1976-10-19,far-right,Papelera Española building
Basque Nationalist Party,Sabino Arana,1895-01-01,centre-right,Sabin Etxea
Spanish Socialist Workers' Party,Pablo Iglesias Posse,1879-05-02,centre-left,calle de Ferraz
Spanish Communist Workers' Party,Enrique Líster,1973-01-01,far-left,Seville
Democratic and Social Centre,Adolfo Suárez,1982-07-20,centrism,Madrid
Union of the Democratic Centre,Adolfo Suárez,1977-05-03,centrism,Madrid
Falange Española de las JONS,José Antonio Primo de Rivera,1934-02-01,far-right,Madrid
Communist Party of Spain,Jules Humbert-Droz,1921-11-14,left-wing,Madrid
People's Alliance,Manuel Fraga Iribarne,1976-10-09,right-wing,Madrid
