col0,col1,col2
Naruto Shippuden the Movie,Aniplex,Naruto
Grave of the Fireflies,Studio Ghibli,Grave of the Fireflies
OniAi,Silver Link,Oniichan dakedo Ai sae Areba Kankeinai yo ne!
Ore no Imōto ga Konna ni Kawaii Wake ga Nai.,A-1 Pictures,Ore no Imōto ga Konna ni Kawaii Wake ga Nai
Doctor Slump,Toei Animation,Dr. Slump
Is the Order a Rabbit?,White Fox,Is the Order a Rabbit?
In This Corner of the World,MAPPA,In This Corner of the World
Non Non Biyori,Silver Link,Non Non Biyori
YuruYuri,Doga Kobo,YuruYuri
