col0,col1,col2
Natoli,Natoli,Palermo
St Woolos Primary School,Grade II listed building,Newport
Grundschule an der Boschetsrieder Straße,architectural heritage monument in Bavaria,Thalkirchen-Obersendling-Forstenried-Fürstenried-Solln
Daniel Webster School,place listed on the National Register of Historic Places,Puerto Rico
Bettolle Primary School,Italian national heritage,Sinalunga
Lupo Bonazia Primary School,Italian national heritage,Sinalunga
D.D. Di Castel Maggiore,Italian national heritage,Castel Maggiore
Bundaberg Central State School,listed on the Queensland Heritage Register,Queensland
