col0,col1,col2,col3,col4
Aichi Prefectural Library,Japan,prefectural library of Japan,1959-04-05,Naka-ku
Gifu Prefectural Library,Japan,prefectural library of Japan,1934-04-01,Gifu
Osaka Prefectural Nakanoshima Library,Japan,prefectural library of Japan,1904-03-01,Kita-ku
Okinawa Prefectural Library,Japan,prefectural library of Japan,1910-08-01,Naha
Gunma Prefectural Braille Library,Japan,braille library,1971-05-01,Maebashi
Kyoto Prefectural Library and Archives,Japan,archive,1963-01-01,Sakyō-ku
Miyazaki Prefectural Library,Japan,public library,1902-05-28,Miyazaki
