col0,col1,col2,col3,col4
Minnesota Medical Association,Minneapolis,open-access publisher,United States of America,1853-01-01
Royal Medical Society,Scotland,open-access publisher,United Kingdom,1737-01-01
Royal College of Physicians of Edinburgh,City of Edinburgh,open-access publisher,United Kingdom,1681-01-01
American Society for Microbiology,"Washington, D.C.",open-access publisher,United States of America,1899-01-01
Philadelphia Academy of Surgery,Philadelphia,medical society,United States of America,1879-01-01
Lexington Medical Society,Kentucky,medical society,United States of America,1799-01-01
European Society of Cataract and Refractive Surgeons,Dublin,medical society,Ireland,1991-01-01
